{
  "schemaVersion": 1,
  "release": "0.6.5",
  "state": "design",
  "selectionPolicy": "Use the frozen 64 Core names, the first 958 remaining historical names in UTF-8 byte order, then the required UI names zoom-in and zoom-out.",
  "exactCanonicalCount": 1024,
  "exactCoreCount": 64,
  "exactExtendedCount": 960,
  "coreNames": [
    "add",
    "archive",
    "arrow-down",
    "arrow-left",
    "arrow-right",
    "arrow-up",
    "ban",
    "bell",
    "calendar-days",
    "chevron-down",
    "chevron-left",
    "chevron-right",
    "chevron-up",
    "circle-alert",
    "circle-check",
    "circle-minus",
    "circle-plus",
    "circle-x",
    "clock",
    "close",
    "confirm",
    "copy",
    "delete",
    "download",
    "external-link",
    "eye",
    "eye-off",
    "file",
    "folder",
    "funnel",
    "help",
    "home",
    "info",
    "key-round",
    "layout-grid",
    "link",
    "loading",
    "lock",
    "lock-open",
    "log-in",
    "log-out",
    "mail",
    "map-pin",
    "maximize",
    "menu",
    "more-horizontal",
    "palette",
    "pencil",
    "refresh-cw",
    "rocket",
    "rotate-ccw",
    "save",
    "search",
    "send",
    "settings",
    "shield-check",
    "shield-x",
    "snowflake",
    "star",
    "star-half",
    "upload",
    "user-plus",
    "user-round",
    "warning"
  ],
  "extendedNames": [
    "accessibility",
    "activity",
    "ad",
    "air-vent",
    "airplay",
    "alarm-clock",
    "alarm-clock-check",
    "alarm-clock-minus",
    "alarm-clock-off",
    "alarm-clock-plus",
    "alarm-smoke",
    "album",
    "align-center-horizontal",
    "align-center-vertical",
    "align-end-horizontal",
    "align-end-vertical",
    "align-horizontal-distribute-center",
    "align-horizontal-distribute-end",
    "align-horizontal-distribute-start",
    "align-horizontal-justify-center",
    "align-horizontal-justify-end",
    "align-horizontal-justify-start",
    "align-horizontal-space-around",
    "align-horizontal-space-between",
    "align-start-horizontal",
    "align-start-vertical",
    "align-vertical-distribute-center",
    "align-vertical-distribute-end",
    "align-vertical-distribute-start",
    "align-vertical-justify-center",
    "align-vertical-justify-end",
    "align-vertical-justify-start",
    "align-vertical-space-around",
    "align-vertical-space-between",
    "ambulance",
    "ampersand",
    "ampersands",
    "amphora",
    "anchor",
    "angle",
    "antenna",
    "anvil",
    "aperture",
    "app-window",
    "app-window-mac",
    "apple",
    "archive-restore",
    "archive-x",
    "armchair",
    "arrow-big-down",
    "arrow-big-down-dash",
    "arrow-big-left",
    "arrow-big-left-dash",
    "arrow-big-right",
    "arrow-big-right-dash",
    "arrow-big-up",
    "arrow-big-up-dash",
    "arrow-down-a-z",
    "arrow-down-from-line",
    "arrow-down-left",
    "arrow-down-narrow-wide",
    "arrow-down-right",
    "arrow-down-to-dot",
    "arrow-down-to-line",
    "arrow-down-up",
    "arrow-down-wide-narrow",
    "arrow-down-z-a",
    "arrow-left-from-line",
    "arrow-left-right",
    "arrow-left-to-line",
    "arrow-right-from-line",
    "arrow-right-left",
    "arrow-right-to-line",
    "arrow-up-a-z",
    "arrow-up-down",
    "arrow-up-from-dot",
    "arrow-up-from-line",
    "arrow-up-left",
    "arrow-up-narrow-wide",
    "arrow-up-right",
    "arrow-up-to-line",
    "arrow-up-wide-narrow",
    "arrow-up-z-a",
    "arrows-up-from-line",
    "asterisk",
    "astroid",
    "at-sign",
    "atom",
    "audio-lines",
    "audio-lines-off",
    "audio-lines-x",
    "audio-waveform",
    "award",
    "axe",
    "axis-3d",
    "baby",
    "backpack",
    "backspace",
    "badge",
    "badge-alert",
    "badge-cent",
    "badge-check",
    "badge-dollar-sign",
    "badge-euro",
    "badge-help",
    "badge-indian-rupee",
    "badge-info",
    "badge-japanese-yen",
    "badge-minus",
    "badge-percent",
    "badge-plus",
    "badge-pound-sterling",
    "badge-russian-ruble",
    "badge-swiss-franc",
    "badge-turkish-lira",
    "badge-x",
    "baggage-claim",
    "balloon",
    "banana",
    "bandage",
    "banknote",
    "banknote-arrow-down",
    "banknote-arrow-up",
    "banknote-check",
    "banknote-x",
    "barcode",
    "barrel",
    "baseline",
    "bath",
    "battery",
    "battery-charging",
    "battery-full",
    "battery-low",
    "battery-medium",
    "battery-plus",
    "battery-warning",
    "beaker",
    "bean",
    "bean-off",
    "bed",
    "bed-double",
    "bed-single",
    "beef",
    "beef-off",
    "beer",
    "beer-off",
    "bell-check",
    "bell-dot",
    "bell-electric",
    "bell-minus",
    "bell-off",
    "bell-plus",
    "bell-ring",
    "between-horizontal-end",
    "between-horizontal-start",
    "between-vertical-end",
    "between-vertical-start",
    "biceps-flexed",
    "bike",
    "binary",
    "binoculars",
    "biohazard",
    "bird",
    "birdhouse",
    "bitcoin",
    "blend",
    "blender",
    "blinds",
    "blocks",
    "bluetooth",
    "bluetooth-connected",
    "bluetooth-off",
    "bluetooth-searching",
    "bold",
    "bolt",
    "bomb",
    "bone",
    "bone-fracture",
    "book",
    "book-a",
    "book-alert",
    "book-audio",
    "book-check",
    "book-copy",
    "book-dashed",
    "book-down",
    "book-headphones",
    "book-heart",
    "book-image",
    "book-key",
    "book-lock",
    "book-marked",
    "book-minus",
    "book-open",
    "book-open-check",
    "book-open-text",
    "book-plus",
    "book-search",
    "book-text",
    "book-type",
    "book-up",
    "book-up-double",
    "book-user",
    "book-x",
    "bookmark",
    "bookmark-check",
    "bookmark-minus",
    "bookmark-off",
    "bookmark-plus",
    "bookmark-x",
    "boom-box",
    "bot",
    "bot-message-square",
    "bot-off",
    "bottle-wine",
    "bow-arrow",
    "box",
    "boxes",
    "braces",
    "brackets",
    "brain",
    "brain-circuit",
    "brain-cog",
    "brick-wall",
    "brick-wall-fire",
    "brick-wall-shield",
    "briefcase",
    "briefcase-business",
    "briefcase-conveyor-belt",
    "briefcase-medical",
    "bring-to-front",
    "broccoli",
    "broom",
    "broom-sparkles",
    "brush",
    "brush-cleaning",
    "bubbles",
    "bug",
    "bug-off",
    "bug-play",
    "building",
    "building-wide",
    "bus",
    "bus-front",
    "cable",
    "cable-car",
    "cake",
    "cake-slice",
    "calculator",
    "calendar",
    "calendar-arrow-down",
    "calendar-arrow-up",
    "calendar-check",
    "calendar-check-outside",
    "calendar-clock",
    "calendar-cog",
    "calendar-date-one",
    "calendar-fold",
    "calendar-heart",
    "calendar-minus",
    "calendar-minus-outside",
    "calendar-off",
    "calendar-plus",
    "calendar-plus-outside",
    "calendar-range",
    "calendar-search",
    "calendar-sync",
    "calendar-x",
    "calendar-x-outside",
    "calendars",
    "camera",
    "camera-off",
    "candy",
    "candy-cane",
    "candy-off",
    "cannabis",
    "cannabis-off",
    "captions",
    "captions-off",
    "car",
    "car-battery",
    "car-front",
    "car-taxi-front",
    "caravan",
    "card-sim",
    "carrot",
    "case-lower",
    "case-sensitive",
    "case-upper",
    "cassette-tape",
    "cast",
    "castle",
    "cat",
    "cctv",
    "cctv-off",
    "chart-area",
    "chart-bar",
    "chart-bar-big",
    "chart-bar-decreasing",
    "chart-bar-increasing",
    "chart-bar-stacked",
    "chart-candlestick",
    "chart-column",
    "chart-column-big",
    "chart-column-decreasing",
    "chart-column-increasing",
    "chart-column-stacked",
    "chart-gantt",
    "chart-line",
    "chart-network",
    "chart-no-axes-column",
    "chart-no-axes-column-decreasing",
    "chart-no-axes-column-increasing",
    "chart-no-axes-combined",
    "chart-no-axes-gantt",
    "chart-pie",
    "chart-scatter",
    "chart-spline",
    "check-check",
    "check-line",
    "chef-hat",
    "cherry",
    "chess-bishop",
    "chess-king",
    "chess-knight",
    "chess-pawn",
    "chess-queen",
    "chess-rook",
    "chevron-first",
    "chevron-last",
    "chevrons-down",
    "chevrons-down-up",
    "chevrons-left",
    "chevrons-left-right",
    "chevrons-left-right-ellipsis",
    "chevrons-right",
    "chevrons-right-left",
    "chevrons-up",
    "chevrons-up-down",
    "church",
    "cigarette",
    "cigarette-off",
    "circle",
    "circle-arrow-down",
    "circle-arrow-left",
    "circle-arrow-out-down-left",
    "circle-arrow-out-down-right",
    "circle-arrow-out-up-left",
    "circle-arrow-out-up-right",
    "circle-arrow-right",
    "circle-arrow-up",
    "circle-check-big",
    "circle-chevron-down",
    "circle-chevron-left",
    "circle-chevron-right",
    "circle-chevron-up",
    "circle-dashed",
    "circle-divide",
    "circle-dollar-sign",
    "circle-dot",
    "circle-dot-dashed",
    "circle-ellipsis",
    "circle-equal",
    "circle-euro",
    "circle-fading-arrow-up",
    "circle-fading-plus",
    "circle-gauge",
    "circle-off",
    "circle-parking",
    "circle-parking-off",
    "circle-pause",
    "circle-percent",
    "circle-pile",
    "circle-play",
    "circle-pound-sterling",
    "circle-power",
    "circle-slash",
    "circle-slashed",
    "circle-small",
    "circle-star",
    "circle-stop",
    "circle-user",
    "circle-user-round",
    "circuit-board",
    "citrus",
    "clapperboard",
    "clipboard",
    "clipboard-check",
    "clipboard-clock",
    "clipboard-copy",
    "clipboard-list",
    "clipboard-minus",
    "clipboard-paste",
    "clipboard-pen",
    "clipboard-pen-line",
    "clipboard-plus",
    "clipboard-type",
    "clipboard-x",
    "clock-alert",
    "clock-arrow-down",
    "clock-arrow-left",
    "clock-arrow-right",
    "clock-arrow-up",
    "clock-check",
    "clock-fading",
    "clock-hour-1",
    "clock-hour-10",
    "clock-hour-11",
    "clock-hour-12",
    "clock-hour-2",
    "clock-hour-3",
    "clock-hour-5",